{
  "profileId": "positing-boundary-candidate",
  "positingMorphism": {
    "id": "morphism:positing",
    "categoryPosition": "predicating/library/predication-category/positing",
    "kind": "scott-continuous-category-generator",
    "operation": "knowledge-order-least-extension",
    "formula": "v join_k delta_(phi,q)",
    "knowledgeMonotone": true,
    "scottContinuous": true,
    "leastExtension": true,
    "changesOnlyPredicateFiber": true,
    "changesOnlyEntityPairCoordinate": true,
    "settlingDownstream": true,
    "recordsDownstream": true,
    "evidence": [
      "development/active/.../predication-category/positing/positing.schema.json"
    ]
  },
  "fiberParameters": {
    "generalCarrier": "L^bowtie",
    "predicateCategory": "C",
    "entityIndex": "E x E",
    "activeSpecialization": "FOUR/articulation-cell",
    "specializationOnly": true,
    "generalDatumSchemaStatus": "open",
    "evidence": [
      "development/active/.../predication-category/positing/positing.schema.json",
      "development/active/.../predication-category/positing/scripts/posit.mjs"
    ]
  },
  "naturality": {
    "theoremStatus": "proved-corpus",
    "equation": "f*(posit_(phi,q)(v)) = posit_(f*(phi),q)(f*(v))",
    "datumPreserved": true,
    "twoCellStatus": true,
    "generatorActions": [
      {
        "class": "specialization",
        "cellAction": "(s,p,o) maps to (s,p',o)",
        "valueAction": "q preserved",
        "evidence": ["development/active/.../positing-naturality/docs/dev/journal/2026-05-24.md"]
      },
      {
        "class": "converse",
        "cellAction": "(s,p,o) maps to (o,p^c,s)",
        "valueAction": "q preserved",
        "evidence": ["development/active/.../positing-naturality/docs/dev/journal/2026-05-24.md"]
      },
      {
        "class": "subject-projection",
        "cellAction": "(s,p,o) maps to (s,p_s)",
        "valueAction": "q preserved",
        "evidence": ["development/active/.../positing-naturality/docs/dev/journal/2026-05-24.md"]
      },
      {
        "class": "object-projection",
        "cellAction": "(s,p,o) maps to (o,p_o)",
        "valueAction": "q preserved",
        "evidence": ["development/active/.../positing-naturality/docs/dev/journal/2026-05-24.md"]
      }
    ],
    "batchProjectionStatus": "open",
    "evidence": [
      "development/active/.../positing-naturality/docs/dev/journal/2026-05-24.md"
    ]
  },
  "speechActFactorization": {
    "distinctCategoricalPositions": true,
    "canonicalOrder": "locution -> illocution -> perlocution",
    "roles": [
      {
        "name": "locution",
        "categoricalPosition": "positing/hacking/library/locution",
        "role": "environmental delivery and decoding into typed internal input",
        "effectBoundary": "environmental-decoding",
        "evidence": ["development/active/.../positing/hacking/library/locution/docs/dev/journal/2026-05-24.md"]
      },
      {
        "name": "illocution",
        "categoricalPosition": "positing/hacking/library/illocution",
        "role": "pure event-bounded positing act",
        "effectBoundary": "pure-event",
        "noIo": true,
        "noClosureFiring": true,
        "evidence": ["development/active/.../positing/hacking/library/illocution/docs/dev/journal/2026-05-24.md"]
      },
      {
        "name": "perlocution",
        "categoricalPosition": "positing/settling/hacking/perlocuting/library/perlocution",
        "role": "closure-unit propagation after the positing event",
        "effectBoundary": "closure-propagation",
        "closureToLeastFixedPoint": true,
        "evidence": ["development/active/.../settling/hacking/perlocuting/library/perlocution/docs/dev/journal/2026-05-24.md"]
      }
    ],
    "noBundledMorphism": true,
    "evidence": [
      "development/active/.../positing/hacking/library/locution/docs/dev/journal/2026-05-24.md",
      "development/active/.../positing/hacking/library/illocution/docs/dev/journal/2026-05-24.md",
      "development/active/.../settling/hacking/perlocuting/library/perlocution/docs/dev/journal/2026-05-24.md"
    ]
  },
  "rowBoundary": {
    "categoricalOutput": "predication-valuation",
    "eventPresentation": "exact-eavt-row",
    "rowsAreFiniteCarrier": true,
    "sampleRows": [
      {
        "e": "cell:task-17/status",
        "a": "positing:assertive",
        "v": "active-articulation-cell:true",
        "t": "2026-05-27T00:00:01Z"
      }
    ],
    "axesCarriedElsewhere": true,
    "evidence": [
      "TRACE-AXES.md",
      "development/active/.../positing-entry/docs/dev/journal/2026-05-24.md"
    ]
  },
  "downstreamBoundary": {
    "writesArePerlocution": true,
    "closureFiringIsPerlocution": true,
    "logsArePresentations": true,
    "positionValueProjectedFromTrace": true,
    "entryDoesNotCarryChargeField": true,
    "evidence": [
      "development/active/.../positing-entry/docs/dev/journal/2026-05-24.md",
      "development/active/.../settling/hacking/perlocuting/library/perlocution/docs/dev/journal/2026-05-24.md"
    ]
  },
  "openObligations": [
    "derive the general L datum schema beyond the active FOUR/articulation-cell specialization",
    "formalize batch positing naturality for projection generators",
    "derive the exact bridge from categorical positing output to EAVT event presentation"
  ],
  "evidence": [
    "POSITING.md",
    "CATEGORICAL-MACHINERY.md",
    "RESEARCH-LEDGER.md"
  ]
}
